<?xml version="1.0" encoding="UTF-8"?>
<!DOCTYPE banco SYSTEM "banco_lorca.dtd">

<banco>
    <sucursal id="SU1">
        <cuentaCorriente codigo="7891">
            <cliente nif="09115Y">
                <operaciones>
                    Retirada de dinero
                </operaciones>
                <privilegios>
                    Máximos
                </privilegios>
                <prestamosConcedidos>
                    2
                </prestamosConcedidos>
            </cliente>
            <cliente nif="37845L">
                <operaciones>
                    Ingreso de dinero
                </operaciones>
                <privilegios>
                    Mínimos
                </privilegios>
                <prestamosConcedidos>
                    0
                </prestamosConcedidos>
            </cliente>
            <domiciliaciones>
                Málaga, Madrid
            </domiciliaciones>
        </cuentaCorriente>
    </sucursal>
    <sucursal id="SU2">
        <cuentaCorriente codigo="4561">
            <cliente nif="078945Z">
                <operaciones>
                    Retirada de dinero
                </operaciones>
                <privilegios>
                    Medios
                </privilegios>
                <prestamosConcedidos>
                    0
                </prestamosConcedidos>
            </cliente>
            <domiciliaciones>
                Barcelona, Valencia
            </domiciliaciones>
        </cuentaCorriente>
    </sucursal>
</banco>